麦克华斯基欧尼,普通用户,其他,其实如果没有病毒，这么让我一天懒在家里甚至烂在家里我都能幸福的再发个芽出来。只是有病毒，总得担心身边不得不出门去的家人朋友，越担心越焦虑，这日子在焦虑中就变的有些疾苦了，总觉得遥遥无期十四天又十四天。天上的神仙啊，放过水深火热中的无辜生命吧，真的拜托了。#新冠肺炎进入第二波流行上升期# 收起全文d,收藏转发评论 1赞2,02月01日 22:27
麦客MikeCRM,蓝V,None,【疫情应对｜远程办公终极解决方案】受新冠疫情影响，许多企业需要紧急制定一套适用于自己团队的远程办公方案。基于此，我们愿意借这篇文章，将麦客团队长期使用的远程办公方案分享给大家??希望这套教程不仅能在眼下的非常时期，也能在今后有需要时为大家提供帮助??祝大家平安、健康?? O疫情应对｜远程办公终极解决方案 收起全文d,收藏转发 3评论 7赞4,02月01日 22:20微博 weibo.com
卖脑子的猪,黄V,广东,# 对新冠病毒事件的个人感言 # ??一直以来都特别鄙视破坏规则的人因为极度自私影响到他人及社会就像这次的新冠病毒事件因为一个人的自私让全国人民恐慌让医护工作者面临着生命的危险让他们背后的家庭有可能遭受到破碎让无数企业及商户受到生存危机让中国经济受到恶性打击无数的人要为破坏规则的人买单这些年在商场和在感情上我都遇到过顶级的人渣因为一己私利罔顾道德法律股东利益因为自私和逃避责任可以不顾对方生死有的人会说这个社会就这样我想说的是这个社会不是这样的明知道是错误明知道违法却去顺从去违背良心还美其名生活所逼谁的生活没有压力和无奈那为什么还有人去坚持规则和真理在社会需要的时候站出来奉献也恰恰正是因为这是生活得像个人如果非得扯上利益我只能说人生是长跑不是一两百米纵观各个龙头企业哪一家不是在规则和体制下各显神通如果粗暴的操作会有精品那不会有百年企业细水长流不管是事业家庭爱情都需要经营种善因得善果希望遵守规则乐于奉献的好人一生平安。 收起全文d,收藏转发评论赞,02月01日 22:28假的iPhone客户端
满分儿好运,普通用户,其他,#抗击肺炎关爱医护#与爱同路，让爱回家。我在“疫情一线医护?守护者后盾行动”项目捐款成功！您每捐款1元，新浪同时配捐1元！ 愿我和@筱白小仙女0227 一起放大爱的力量！@北京感恩公益基金会 疫情一线医护?守护者后盾行动 ?,收藏转发评论赞,02月01日 22:58微公益
曼_舞轻歌,普通用户,辽宁 沈阳,#湖北疫情期间开展网络教学##湖北疫情防控工作发布会#视教学内容而定。 O疫情期间该不该开展网络教学？你是否支持? ?,收藏转发评论赞,02月01日 22:57iPhone客户端
曼曼和悠悠,普通用户,山西 长治,『深度剖析“新冠疫情”对期货各品种的影响』O深度剖析“新冠疫情”对期货各品种的影响 ?,收藏转发 1评论 1赞,02月01日 22:42HUAWEI Mate 10
蔓夫斯基,普通用户,其他,真不是我说又给猫买了几百块吃的?保健品感天动地好主人可惜猫不领情不好好吃饭不吃猫粮只想吃肉瘦的像一根擀面杖就算疫情再严重也得奔赴超市给猫买肉亲自下厨做饭感动哭了请猫珍惜我 ?,收藏转发评论 3赞2,02月01日 22:59iPhone客户端
慢半拍呐,普通用户,河北 承德,新冠还没有走，禽流感又来了 2随州 ?,收藏转发评论赞,02月01日 22:42iPhone客户端
猫头鹰起飞了,普通用户,浙江,#武汉加油##我用脑洞画海报# #白衣天使加油# 消灭病毒！打倒新冠！武汉加油！中国加油！致敬所有奋斗在前线的工作者们！有你们，我们一定可以战胜疫病！@你丫才美工 ?,收藏转发 11评论 4赞44,02月01日 22:47360安全浏览器
猫知菇凉,普通用户,其他,#新冠肺炎或可粪口传播#晕…真是无孔不入啊… ?,收藏转发评论赞,02月01日 22:55华为畅享10 Plus
茅滩酒屋,普通用户,贵州 遵义,【仁怀酒协发文征集医疗物资采购线索】截止2020年2月1日18:00，仁怀市酒业协会已募集善款243.17万元及部分医用物资，并采购医用口罩20万只。由于众所周知的原因，截止2月1日21：00，口罩、消毒液、防护服等医用物资的采购，仍未取得实质性的新进展。当前，新冠肺炎疫情防控工作已到了关键时期。为此，恳请仁怀乡友、客商、酿酒人、企业家及社会各界人士，帮助对接省内外医用物资，提供一手采购线索。酒业协会将竭尽所能采购并及时发放、捐赠。采购物资：一次性医用口罩、外科口罩、N95口罩、消毒液、防护服等采购要求：1.口罩采购数量30万只起。消毒液、防护服若干。2.必须符合或高于国家标准，确保医用。3.至迟2月5日晚前运抵到贵州。4.采购价格可随行就市。5.我方可提供相应公函。联系人：杨必刚：13511874553　              周山荣：19985125039 收起全文d,收藏转发评论赞,02月01日 22:42HUAWEI Mate 30 5G
每天都很难专家,普通用户,其他,趁着这段休闲时间减减肥然后找到想见的人疫情结束就去见吧 ?,收藏转发评论赞,02月01日 22:57iPhone客户端
美关公,蓝V,None,#万众一心抗击新冠肺炎#  #美关公# 抗击新型肺炎疫情，这9个谣言和真相您要知道！坚定信念，科学防控。by@丁香园 ?,收藏转发评论赞3,02月01日 22:52搜狗高速浏览器
美国留学中心,普通用户,海外 美国,"【 ???抱团贴】开个贴给你们同校、同届、同航班的铁子们——评论区抱抱团、互帮互助。事情是这样的 最近被私、被留言了好多“主页菌 我几号几号的飞机还能回某某校吗？”“…某某大学开学是否会延期 延到啥时候？”“某某校对中国留学生有啥政策？”balabala，SO,给铁子们开个专机（博），提出你的问题+留言你的学校是否开学，针对新型冠状病毒采取什么措施，对中国留学生有没有什么政策等等等等……并挑一个问题回答。灾害面前，我们凝聚在一起了，众志成城 互相帮扶吧，总之这条下面欢迎留言。#美国出现第7例新冠肺炎确诊病例# #美国# #近期有关国家入境管制措施实时更新# #留学##武汉加油# 收起全文d",收藏转发 3评论 13赞11,02月01日 22:28微博 weibo.com
美妮的寻,普通用户,北京,总有一些单位认为北京人民没了它就活不了，明明zf说非必要单位不要上班，这不是给疫情添乱吗 ?,收藏转发评论赞2,02月01日 22:59iPhone客户端
美少女小bu系浪B,普通用户,其他,文华花园真的中招了吗？#疫情# 怕怕的 2佛山·龙江 ?,收藏转发评论赞,02月01日 22:58红米Redmi
美食日记u,普通用户,江苏 泰州,#湖南发生一起禽流感疫情#传不传人啊 ?,收藏转发评论赞,02月01日 22:59小米8周年旗舰手机
媚瘦纤体,蓝V,None,【针对新型冠状病毒的AI诊断技术上线 疑似病例全基因分析缩至半小时】2月1日，浙江省疾控中心上线针对新冠病毒的全基因组检测分析平台，采用对病毒样本进行全基因组序列分析，能够有效防止病毒变异产生的漏检，并将原来数小时的疑似病例基因分析缩短至半小时，大幅提高疑似病例的确诊速度和准确率。据疾控中心介绍，这套AI诊断算法由阿里巴巴达摩院研发。未来，该技术还将支持疫苗与药物的研发。（via新华网）L环球科技日报的秒拍视频 收起全文d,收藏转发评论赞,02月01日 19:13Android
孟连微博,蓝V,None,#加强疫情防控 云南在行动#【大理州首例新型冠状病毒感染肺炎患者出院】微博正文 请开启浏览器的 JavaScript 支持后，刷新页面再试。 注册/登录 云南发布 10小时前 来自 专业版微博 #加强疫情防控 云南在行动#【大理州首例新型冠状病毒 O网页链接 ?,收藏转发评论赞1,02月01日 22:58钉钉
孟连微博,蓝V,None,#加强疫情防控 云南在行动#【云南省卫生健康委组织开展新型冠状病毒感染的肺炎巡回医疗暨督导工作】微博正文 请开启浏览器的 JavaScript 支持后，刷新页面再试。 注册/登录 云南发布 13小时前 来自 专业版微博 #加强疫情防控 云南在行动#【云南省卫生健康委组织开 O网页链接 ?,收藏转发评论赞,02月01日 22:57钉钉
梦回藏东,普通用户,海南,新冠肺炎疫情仍在扩散，死亡病例每天还在增加，这当然让人们感受到巨大心理压力，担忧自身和家人的平安，对可能感染新冠病毒产生恐惧和焦虑。这种担心和忧虑应该转化为认真落实各项疫情防控措施，有助于尽快遏制疫情蔓延，却不该变成人人自危的恐慌和过度反应。例如过量购买和囤积口罩及日常生活用品，把周围的人都看成是可能的病毒携带者，在偏远、人口稀少、远离疫区的地方也采取和人口密集、疫情高发区一样的防控方式，见风就是雨、盲目相信那些抗毒护身的“灵丹妙药”，人云亦云地转发、传播并不靠谱的网络传言甚至谣言……过度反应的结果非但无助于疫情防控反而带来种种不良后果，口罩等防护物资更加供不应求，生活用品短缺引发更多人抢购、囤积，流言四起、人心惶惶会使已经受疫情影响的日常生活和社会秩序更加混乱无序。        新冠病毒疫情发生以来，领导机关、卫生防疫部门所发挥的作用、采取的对策，为切断传播途径而实行交通封闭、人员隔离等举措的时机、范围和力度都值得反思自省，也应该允许各界批评。但是本着客观的实事求是的态度，我们应该知道认识并掌握某种病毒的传染源、传播特性和途径并不是容易的事，而采取控制疫情各项措施的范围和力度更是两难选择，交通封闭、人员隔离的力度越大当然越利于疫情控制，但同时意味着社会要付出更大的代价。这也可以解释为什么世卫组织在宣布新冠肺炎为国际关注的突发公共卫生事件的同时强调各国没有理由对国际旅行和贸易进行限制，也就是说世卫不发出国际旅行和贸易警告。        读一下美媒的这篇文章有助于我们从更多的视角看待目前面临的这场疫情。美媒总结美国疫情史给中国的启示：反应过度也有坏处 - 人们关注新型冠状病毒的消息时，很容易忽略公共卫生官员殚精竭虑防止疫情演变成危机或者压制这样一场危机所面临的艰难抉择——通常要在信息匮乏的情况下迅速决断。(@参考消息) O美媒总结美国疫情史给中国的启示：反应过度也有坏处 收起全文d,收藏转发评论赞1,02月01日 22:29bShare分享
梦想家储金波,普通用户,江苏 常州,??2020年2月1日。??疫情还很严重。??请好好待在家里。??也算做贡献了。 ?,收藏转发评论 13赞,02月01日 22:57山寨iPhone XS(银色)
梦月博博,普通用户,江苏,疫情过后留给我们的是一场全面反思呢？还是又一场爱国主义教育呢？ ?,收藏转发评论 1赞17,02月01日 22:57iPhone客户端
咪咕头条资讯,蓝V,None,#新冠病毒可能通过粪便传播# 2月1日晚间，深圳市第三人民医院召开记者会，公布最新发现。该院肝病研究所研究发现，在某些新型冠状病毒感染的肺炎确诊患者的粪便中检测出2019-nCoV核酸（新型冠状病毒）阳性，很有可能提示粪便中有活病毒存在。 ?,收藏转发评论赞,02月01日 22:44
迷你白白桃,普通用户,北京 东城区,哎，以前首页的猫猫狗狗嘻嘻哈哈都看不到了希望疫情能尽快过去拜托了 ?,收藏转发评论赞,02月01日 22:57微博 weibo.com
泌尿男科医师林焕懿,黄V,广东 广州,【深圳确诊患者粪便呈病毒阳性 #新冠肺炎或可粪口传播#】对个人而言，除了戴口罩，手卫生也是非常重要。 ?,收藏转发评论赞1,02月01日 22:49iPhone客户端
棉花糖niki,黄V,其他,每天都是养猪的节奏每天睡到腰骨痛每天坐到屁股痛疫情赶紧过去吧不想再过这躺尸的日子了 ?,收藏转发评论赞,02月01日 22:59仪岐走花路iPhone客户端
勉县外宣,蓝V,None,【防控疫情，勉县在行动】2月1日，县委常委、宣传部部长徒勇到周家山镇检查指导新冠肺炎疫情防控工作。在周家山镇，徒勇同镇主要负责同志研判当前各村（社区）疫情防控工作，要求进一步全面动员、深入排查，做到查清查透、一个不漏；在镇卫生院，徒勇查看了体温检测点、隔离病房设施等情况，叮嘱医务人员在自我安全的前提下，发挥好模范带头作用。#联防联控 汉中在行动# 收起全文d,收藏转发 3评论赞,02月01日 17:38iPhone客户端
喵大人有理,黄V,广东,"#武汉加油# 不是煽情，平时也比较冷漠，就是最近闹得沸沸扬扬那事影响宅家的心情，试问这种时候义无反顾补洞的一线医生到底做错什么，拿生命换生命，也没能让狼心狗肺稍微有点人味。看电视插播的短片都要看哭了，现场的情景怕是只有他们才终生难忘，而我们这种平民百姓，记忆中最后也就多了个""新冠病毒""。都平安，都新年好好的吧，2020，请做个人。 L喵大人有理的微博视频 收起全文d",收藏转发评论赞2,02月01日 22:25喵大人哒Android
妙趣横生葛瑞丝,普通用户,其他,无聊烦素颜照片看 好烦啊 后悔啊 早知道就在疫情前做激光了  唉唉唉唉 ?,收藏转发评论 1赞1,02月01日 22:59iPhone客户端
民心不可伤,普通用户,江苏 苏州,钟南山团队：新冠病毒感染肺炎居家康复及防护策略O网页链接 ?,收藏转发评论赞1,02月01日 22:21
明越_,普通用户,海外,#湖南发生一起禽流感疫情#？？？ ?,收藏转发评论赞,02月01日 22:58iPhone客户端
铭靓一鑫,普通用户,内蒙古,4??2??疫情加重，倍加思念 2乌海 ?,收藏转发评论赞,02月01日 22:59iPhone客户端
末影国王,普通用户,广东 清远,#美首例新冠患者用伦地西韦有效# 好事！ ?,收藏转发评论赞,02月01日 22:29微博极速版
某个某张三,普通用户,湖北 武汉,新冠时期的街道?? 2石家庄 ?,收藏转发评论 1赞,02月01日 22:21iPhone客户端
木_木山_夆,普通用户,安徽 马鞍山,年过完了，要开始奋斗了，希望新冠早点过去，期待夏天好事到来。 ?,收藏转发评论 1赞,02月01日 22:48iPhone客户端
木屋子_,普通用户,北京,疫情原因没有回北京线上忙完沟通协调各种工作和爸爸弟弟在家看小时候看过的电影奶奶在睡觉 妈妈妹妹刷抖音这种生活真的很惬意长大之后难得有机会和家人这么长时间在一起就很幸福了#隔世追魂# ?,收藏转发评论赞,02月01日 22:59iPhone XR
木子呆先生,黄V,海外 美国,武汉新冠肺炎防控指挥部已指派湖北九州通医药集团，临时征用为红十字会仓库的武汉汉阳国博中心分装医疗防护物资，目前九州通正紧急召集30余名员工奔赴现场。九州通一位工作人员告诉记者：“物资堆积在那里，该用的物资，想用用不上，我们会帮着红十字会尽快处理。” ?,收藏转发评论 2赞2,02月01日 22:18微博 weibo.com
沐子阳ing,普通用户,北京,我是#白杨师姐写作陪伴营# 的“沐子_旸”，我正在参加#超级行动力# 陪伴营，2020专注修炼的硬本领是“写作-减重10斤”。今天是024/365天。下面是我的成长复盘：突如其来的新冠疫情让这个新年蒙上了一层阴影，大家都在家里没有办法外出，这对于要减重的我是很大的不利因素。光输入营养，输出的时间少，只能减少食量，多做做室内运动了。半个月窝在家里都快憋疯了。武汉加油，相信我们团结一致，一定可以攻克难关。今天两顿饭，每次只吃小半碗，晚饭后在楼下公园跑了一圈，希望春暖花开之时展现好身材。加油??@张萌_萌姐 @白杨师姐 @Andy白杨助理 2北京 收起全文d,收藏转发评论赞1,02月01日 22:50iPhone 7
牧童遥指又一村,黄V,四川,#万众一心抗击新冠肺炎# 一颗颗太阳的种子，伴着温暖的水分子，浸润了每一个细胞，在体内如阳光升腾，#手冲咖啡# ?,收藏转发评论 1赞1,02月01日 22:10HUAWEI Mate 10 Pro
慕容香薇0,普通用户,其他,未来7天是疫情小高峰期！大伙再坚持坚持，戴口罩勤洗手不聚集不出门！看图中数据，是不是感觉到了希望？感觉到春暖花开的步子在靠近？较之昨天，疑似人数有所下降，治愈人数有所上升。加油中国！ ?,收藏转发评论赞,02月01日 22:57荣耀20i
慕汐8063,普通用户,河南 平顶山,#湖南禽流感# 刚感觉新冠看到了一些希望 这又来了个什么鬼东西 想哭 2020这个头开得太难了 ?,收藏转发评论 1赞,02月01日 22:30iPhone客户端
拿刀的好人,普通用户,其他,如果疫情好转，我先来两碗20的麻辣烫 ?,收藏转发评论 1赞1,02月01日 22:59Samsung Galaxy S8
那个ta啊_,普通用户,上海 浦东新区,如果说这是中国在走向复兴前的一次考验，那么我相信中国一定不会辜负世界70亿人的期待。医护人员们，你们是最伟大的！感谢你们的默默付出。天佑武汉，天佑中华。愿我们全国人民共同努力，战胜疫情。我在中国·辽宁！加油！#武汉加油# ?,收藏转发评论赞5,02月01日 22:59前置双摄vivo X9
那就叫吴吴吧,普通用户,内蒙古,『实时更新|新型冠状病毒肺炎全国疫情地图』O实时更新|新冠肺炎疫情地图 ?,收藏转发评论赞,02月01日 22:59iPhone客户端
那蓝小小,普通用户,湖南,在家呆着实在有点无聊，就去老家后面的山上拍了几张照，希望疫情早点结束，大家都越来越好 2浏阳市 ?,收藏转发评论 18赞24,02月01日 22:59
那一片苦海,黄V,广西,上海新增1例新冠肺炎死亡病例，抗击肺炎，白衣天使加油，中国加油。我们同在。#上海出现首例死亡病例#   #武汉加油#  L那一片苦海的微博视频 ?,收藏转发评论赞4,02月01日 22:08微博视频
纳西塞斯的倒影,普通用户,安徽 合肥,面对汹涌而至的新冠病毒，只得暂时放弃心心念念的关西旅行计划。取消了攻略很久的airnb民宿，和亲切的老板短短聊了几句，却感受了来自异国陌生人的暖意。不禁感慨:为什么我们感受到的善意，往往因为有了距离的加持才显得格外珍贵呢？ ?,收藏转发评论赞,02月01日 22:22HUAWEI P20
奶萌酷帅王一宝,普通用户,其他,他们怎么敢？他们就是敢！在全国人民都揪心努力想着怎么用最快方法帮助着疫情灾区的同胞时，却上演吃人血馒头！ ?,收藏转发评论赞,02月01日 22:58iPhone客户端
南Nancy-,普通用户,其他,健身疫情严重宅在家剪了一下19年最后一练的臀打卡????    每周安排两次  ?一次是大重量臀腿   一次是小重量臀为主  视频里是臀为主的一练。??健身小白个人喜好记录而已    大神勿喷哈#健身打卡##健身##蜜桃臀# L南Nancy-的微博视频 ?,收藏转发 10评论 26赞109,02月01日 22:58健身超话
南海发布,蓝V,None,#抗击新冠疫情 南海在行动# 【中国疾控中心提示：不同风险人群防护指南二（出行人员篇）】 ?,收藏转发 1评论 1赞3,02月01日 22:08微博 weibo.com
南海发布,蓝V,None,#抗击新冠疫情 南海在行动# 【截至2020年2月1日12时佛山市新型冠状病毒感染的肺炎疫情情况】2020年1月31日至2月1日12时，佛山市报告新型冠状病毒感染的肺炎新增确诊病例7例，新增确诊病例中顺德区3例、三水区4例。截至2月1日12时，全市累计报告新型冠状病毒感染的肺炎确诊病例39例，其中重症6例，危重1例，出院1例，无死亡病例。有179名密切接触者正在接受医学观察。具体分布：禅城区5例，南海区14例，顺德区13例，三水区7例。O截至2020年2月1日12时佛山市新型冠状病毒感染的肺炎疫情情况 收起全文d,收藏转发 1评论 1赞2,02月01日 17:40小米5s 拍照黑科技
南京美食,黄V,江苏,17年前，非典终将倒下！现在，新冠肺炎一样的命运！稳住，我们能赢！摄：城市摄影队@小飞718 ?,收藏转发 5评论 4赞69,02月01日 22:02
南南北北可爱呀,普通用户,其他,#疫情结束后最想吃的东西# 想念火锅，麻辣香锅，麻辣拌，再来一杯coco奶茶三兄弟 ?,收藏转发评论赞,02月01日 22:59小米Note 3 拍人更美
南铁鹰潭车站,蓝V,None,#2020铁路春运##打赢新冠肺炎阻击战南铁人在行动# 【面对疫情 烈士的同事们挺身而出】三十年前，熊云清烈士为了保护旅客的安全，牺牲了自己的生命；三十年后，面对这场突如其来的疫情，熊云清的同事们，选择挺身而出，站在了保护旅客安全的最前面。O面对疫情 烈士的同事们挺身而出 ?,收藏转发评论赞,02月01日 22:29OPPO Reno 10倍变焦版
南雁飞111,普通用户,河南 濮阳,疫情在扩散，我们人心不能散，为祖国为我们自己，武汉加油，中国加油，一起加油 ?,收藏转发评论赞1,02月01日 22:59小米Note 3 拍人更美
南燕游侠,普通用户,山东 潍坊,奋战在湖北黄冈抗击新冠肺炎疫情第一线，老师为你感到骄傲！老师和同学们为你加油！愿你早日凯旋！ ?,收藏转发评论赞3,02月01日 22:01小米Note 3 拍人更美
难得像个人,普通用户,None,"疫情快点结束吧！疫情一过，我相信接下来2020大家都是平安幸福年，加油武汉，加油福建，加油中国！ #武汉加油,中国加油# ?",收藏转发评论赞2,02月01日 22:58荣耀9 美得有声有色
喃喃娉夏,普通用户,山西 太原,想为6月的高考作文压一次题我猜应该是：患难见真情、中国外交、疫情精神、国心，国情和国人#巴基斯坦##武汉加油##疫情中最勇敢的逆行者# 加油！ 2吕梁 ?,收藏转发评论 3赞6,02月01日 22:59iPhone客户端
内江经济技术开发区,蓝V,None,“新冠”肆虐，守护内江O“新冠”肆虐，守护内江 2内江 ?,收藏转发评论赞,02月01日 22:59华为畅享10 Plus
你sei呀你,普通用户,海外,社会是两个极端的社会 黑心的人恶心到了骨子里 幸好善良的人散发着温柔的光 在疫情面前让我看到胜利的希望 ?,收藏转发评论赞,02月01日 22:59iPhone客户端
你的布朗熊吖,普通用户,其他,现在每天早上起来的日常就是看新闻，时事，希望疫情不要再扩散了??每天都在期盼好消息的到来，也祈祷着每一个正在加班加点工作的人的平平安安，希望你们健康！中国????，加油！！！#勇战疫情中国要强# ?,收藏转发评论赞,02月01日 22:58Android
你的夏玖,普通用户,江西,傻瓜，现在有新冠病毒，你给我悠着点，对自己负责，敢给我生病你试试，尽量少出门，出门记得带口罩(一定要带好)，保持室内卫生，少去封闭场所、医院(特别是急诊，发热科、呼吸内科)、畜养禽兽的地方，有流感或发烧，感冒突然恶化，要及时去医院检查身体。这种病毒会传染，勤洗手，带次性口罩不可以超过4个小时。 收起全文d,收藏转发评论赞1,02月01日 20:53OPPO R9s Plus
你的仙女H,普通用户,河北,在家躺着就为国家做贡献了从来没有想过吧一直羡慕已久的吃…躺…呆着…终于实现了吧！没有什么不是梦少年等疫情结束后，继续加油努力的吧?? ?,收藏转发评论 1赞1,02月01日 22:58HUAWEI Mate 30 5G
你居然不爱吃仙贝,普通用户,浙江 杭州,#湖南发生一起禽流感疫情#  鸡也不能吃了，馋了好久的炸鸡了 ?,收藏转发评论赞2,02月01日 22:58微博国际版
你是姑娘啊,普通用户,浙江 衢州,我在想 疫情那么严重 那么那些环卫工人怎么办 他们每天要接触很多垃圾 很危险 百姓在忧国忧民 一些领导在却在保全自己 红十在做一些不是人干的事 还有不明网友在关注维护“叉酱” 在声讨演唱会不能开了 电视剧不能拍了 爱豆不能追了 拜托清醒理智点 国难当头现在还有很多人没有口罩 得不到治疗 吃野味的 心不善的是该死 但是现在的关注应该在救治和扩大救治以及预防还有救援物资的落实上那些黑心??你们做个人吧 别发国难财了 别贪了 迟早会下马的 收起全文d,收藏转发评论赞4,02月01日 22:57OPPO智能手机
你听到了没我什么都不想说,普通用户,江苏 南京,经历了这次疫情 我终于明白了像我这种平时不怎么玩游戏  不会打麻将社交都靠出去见面吃饭逛街看电影的人实在是太不容易了可能是要给社会给淘汰了 ?,收藏转发评论赞,02月01日 22:57iPhone客户端
年华如羽ccxy,普通用户,其他,今日压轴负能量，半夜气吐血系列：#财新周刊#【封面报道|37位记者四万字全景调查：新冠病毒何以至此？】  O封面报道|新冠病毒何以至此（来自财新客户端） ?,收藏转发评论赞,02月01日 22:11iPhone客户端
